{
  "schema_version": "v12.browser_network_log.v1",
  "test_run_id": "v12-readonly-canvas-foundation",
  "page_url": "http://127.0.0.1:4174/?studio=v12-readonly-canvas",
  "requests": [
    {
      "method": "GET",
      "url": "http://127.0.0.1:4174/?studio=v12-readonly-canvas",
      "allowed": true
    },
    {
      "method": "GET",
      "url": "http://127.0.0.1:4174/assets/index-DPmwXyRr.js",
      "allowed": true
    },
    {
      "method": "GET",
      "url": "http://127.0.0.1:4174/assets/index-RKSNFis4.css",
      "allowed": true
    }
  ],
  "forbidden_route_scan": {
    "status": "PASS",
    "forbidden_matches": []
  },
  "created_at": "2026-06-11T00:00:00Z"
}
